{
  "schemaVersion": "phase0-issue-register-v1",
  "registerID": "phase0-environment-creation-path-issues",
  "createdAt": "2026-07-13T22:20:00-04:00",
  "updatedAt": "2026-07-14T03:30:00-04:00",
  "issues": [
    {
      "issueID": "issue-phase0-appearance-control-ear-shape-recapture",
      "kind": "recaptureRequired",
      "title": "Complete Ear Shape selector evidence",
      "description": "Current evidence is directly observed but incomplete for production: no complete first-to-final selector run, wrap proof, visible default proof, second review, or production-standard capture.",
      "owner": "wyatt-skaggs",
      "severity": "blocking",
      "status": "open",
      "affectedRecordIDs": [
        "CF27_XBOXUNKNOWN_RTG_EARSHAPE_001",
        "CF27_XBOXUNKNOWN_RTG_EARSHAPE_002",
        "CF27_XBOXUNKNOWN_RTG_EARSHAPE_003",
        "CF27_XBOXUNKNOWN_RTG_EARSHAPE_004"
      ],
      "affectedEvidenceFileIDs": [],
      "createdAt": "2026-07-14T01:15:00-04:00",
      "updatedAt": "2026-07-14T01:15:00-04:00",
      "resolutionNotes": "",
      "recaptureRequest": {
        "required": true,
        "queueStatus": "queued",
        "requestedAngles": [],
        "requestedEvidenceKinds": [
          "Menu label and selected native value visible for every deliberately selected option.",
          "First-value proof.",
          "Final-value proof.",
          "Wrap or no-wrap proof.",
          "Visible default proof.",
          "Second-person verification.",
          "Dependency check against platform, mode, creation path, head, skin presentation, and relevant account/entitlement state."
        ],
        "owner": "wyatt-skaggs",
        "priority": "blocking",
        "notes": "Record Ear Shape from the first available value through the final available value, pausing on each selected value long enough for label and character state review. Include beginning boundary, final boundary, wrap/no-wrap evidence, default state evidence, and dependency notes."
      }
    },
    {
      "issueID": "issue-phase0-appearance-control-eye-color-recapture",
      "kind": "recaptureRequired",
      "title": "Complete Eye Color selector evidence",
      "description": "Current evidence is directly observed but incomplete for production: no complete first-to-final selector run, wrap proof, visible default proof, second review, or production-standard capture.",
      "owner": "wyatt-skaggs",
      "severity": "blocking",
      "status": "open",
      "affectedRecordIDs": [
        "CF27_XBOXUNKNOWN_RTG_EYECOLOR_001",
        "CF27_XBOXUNKNOWN_RTG_EYECOLOR_002",
        "CF27_XBOXUNKNOWN_RTG_EYECOLOR_003",
        "CF27_XBOXUNKNOWN_RTG_EYECOLOR_004",
        "CF27_XBOXUNKNOWN_RTG_EYECOLOR_005",
        "CF27_XBOXUNKNOWN_RTG_EYECOLOR_006",
        "CF27_XBOXUNKNOWN_RTG_EYECOLOR_007"
      ],
      "affectedEvidenceFileIDs": [],
      "createdAt": "2026-07-14T01:15:00-04:00",
      "updatedAt": "2026-07-14T01:15:00-04:00",
      "resolutionNotes": "",
      "recaptureRequest": {
        "required": true,
        "queueStatus": "queued",
        "requestedAngles": [],
        "requestedEvidenceKinds": [
          "Menu label and selected native value visible for every deliberately selected option.",
          "First-value proof.",
          "Final-value proof.",
          "Wrap or no-wrap proof.",
          "Visible default proof.",
          "Second-person verification.",
          "Dependency check against platform, mode, creation path, head, skin presentation, and relevant account/entitlement state."
        ],
        "owner": "wyatt-skaggs",
        "priority": "blocking",
        "notes": "Record Eye Color from the first available value through the final available value, pausing on each selected value long enough for label and character state review. Include beginning boundary, final boundary, wrap/no-wrap evidence, default state evidence, and dependency notes."
      }
    },
    {
      "issueID": "issue-phase0-appearance-control-eye-shape-recapture",
      "kind": "recaptureRequired",
      "title": "Complete Eye Shape selector evidence",
      "description": "Current evidence is directly observed but incomplete for production: no complete first-to-final selector run, wrap proof, visible default proof, second review, or production-standard capture.",
      "owner": "wyatt-skaggs",
      "severity": "blocking",
      "status": "open",
      "affectedRecordIDs": [
        "CF27_XBOXUNKNOWN_RTG_EYESHAPE_001",
        "CF27_XBOXUNKNOWN_RTG_EYESHAPE_002",
        "CF27_XBOXUNKNOWN_RTG_EYESHAPE_003",
        "CF27_XBOXUNKNOWN_RTG_EYESHAPE_004",
        "CF27_XBOXUNKNOWN_RTG_EYESHAPE_005"
      ],
      "affectedEvidenceFileIDs": [],
      "createdAt": "2026-07-14T01:15:00-04:00",
      "updatedAt": "2026-07-14T01:15:00-04:00",
      "resolutionNotes": "",
      "recaptureRequest": {
        "required": true,
        "queueStatus": "queued",
        "requestedAngles": [],
        "requestedEvidenceKinds": [
          "Menu label and selected native value visible for every deliberately selected option.",
          "First-value proof.",
          "Final-value proof.",
          "Wrap or no-wrap proof.",
          "Visible default proof.",
          "Second-person verification.",
          "Dependency check against platform, mode, creation path, head, skin presentation, and relevant account/entitlement state."
        ],
        "owner": "wyatt-skaggs",
        "priority": "blocking",
        "notes": "Record Eye Shape from the first available value through the final available value, pausing on each selected value long enough for label and character state review. Include beginning boundary, final boundary, wrap/no-wrap evidence, default state evidence, and dependency notes."
      }
    },
    {
      "issueID": "issue-phase0-appearance-control-nose-recapture",
      "kind": "recaptureRequired",
      "title": "Complete Nose selector evidence",
      "description": "Current evidence is directly observed but incomplete for production: no complete first-to-final selector run, wrap proof, visible default proof, second review, or production-standard capture.",
      "owner": "wyatt-skaggs",
      "severity": "blocking",
      "status": "open",
      "affectedRecordIDs": [
        "CF27_XBOXUNKNOWN_RTG_NOSE_001",
        "CF27_XBOXUNKNOWN_RTG_NOSE_002",
        "CF27_XBOXUNKNOWN_RTG_NOSE_003",
        "CF27_XBOXUNKNOWN_RTG_NOSE_004",
        "CF27_XBOXUNKNOWN_RTG_NOSE_005",
        "CF27_XBOXUNKNOWN_RTG_NOSE_006",
        "CF27_XBOXUNKNOWN_RTG_NOSE_007"
      ],
      "affectedEvidenceFileIDs": [],
      "createdAt": "2026-07-14T01:15:00-04:00",
      "updatedAt": "2026-07-14T01:15:00-04:00",
      "resolutionNotes": "",
      "recaptureRequest": {
        "required": true,
        "queueStatus": "queued",
        "requestedAngles": [],
        "requestedEvidenceKinds": [
          "Menu label and selected native value visible for every deliberately selected option.",
          "First-value proof.",
          "Final-value proof.",
          "Wrap or no-wrap proof.",
          "Visible default proof.",
          "Second-person verification.",
          "Dependency check against platform, mode, creation path, head, skin presentation, and relevant account/entitlement state."
        ],
        "owner": "wyatt-skaggs",
        "priority": "blocking",
        "notes": "Record Nose from the first available value through the final available value, pausing on each selected value long enough for label and character state review. Include beginning boundary, final boundary, wrap/no-wrap evidence, default state evidence, and dependency notes."
      }
    },
    {
      "issueID": "issue-phase0-appearance-control-skin-details-recapture",
      "kind": "recaptureRequired",
      "title": "Complete Skin Details selector evidence",
      "description": "Current evidence is directly observed but incomplete for production: no complete first-to-final selector run, wrap proof, visible default proof, second review, or production-standard capture.",
      "owner": "wyatt-skaggs",
      "severity": "blocking",
      "status": "open",
      "affectedRecordIDs": [
        "CF27_XBOXUNKNOWN_RTG_SKINDETAILS_001",
        "CF27_XBOXUNKNOWN_RTG_SKINDETAILS_002",
        "CF27_XBOXUNKNOWN_RTG_SKINDETAILS_003",
        "CF27_XBOXUNKNOWN_RTG_SKINDETAILS_004",
        "CF27_XBOXUNKNOWN_RTG_SKINDETAILS_005",
        "CF27_XBOXUNKNOWN_RTG_SKINDETAILS_006",
        "CF27_XBOXUNKNOWN_RTG_SKINDETAILS_007",
        "CF27_XBOXUNKNOWN_RTG_SKINDETAILS_008",
        "CF27_XBOXUNKNOWN_RTG_SKINDETAILS_009",
        "CF27_XBOXUNKNOWN_RTG_SKINDETAILS_010"
      ],
      "affectedEvidenceFileIDs": [],
      "createdAt": "2026-07-14T01:15:00-04:00",
      "updatedAt": "2026-07-14T01:15:00-04:00",
      "resolutionNotes": "",
      "recaptureRequest": {
        "required": true,
        "queueStatus": "queued",
        "requestedAngles": [],
        "requestedEvidenceKinds": [
          "Menu label and selected native value visible for every deliberately selected option.",
          "First-value proof.",
          "Final-value proof.",
          "Wrap or no-wrap proof.",
          "Visible default proof.",
          "Second-person verification.",
          "Dependency check against platform, mode, creation path, head, skin presentation, and relevant account/entitlement state."
        ],
        "owner": "wyatt-skaggs",
        "priority": "blocking",
        "notes": "Record Skin Details from the first available value through the final available value, pausing on each selected value long enough for label and character state review. Include beginning boundary, final boundary, wrap/no-wrap evidence, default state evidence, and dependency notes."
      }
    },
    {
      "issueID": "issue-phase0-appearance-control-skin-tone-recapture",
      "kind": "recaptureRequired",
      "title": "Complete Skin Tone selector evidence",